{
  "schema_version": "obs.evidence_index.v2",
  "run_id": "R-TEST",
  "target_id": "local",
  "windows": [],
  "raw_refs": {},
  "data_quality": {
    "dropped": false,
    "drop_count": 0,
    "throttled": false,
    "missing": [],
    "truncated": false,
    "clock_confidence": "medium",
    "notes": []
  }
}
